{
  "url": "https://github.com/hyperium/hyper",
  "owner": "hyperium",
  "name": "hyper",
  "stars": 14000,
  "forks": 1400,
  "language": "Rust",
  "last_activity": "2024-07-03T12:00:00Z",
  "issue_count": 95,
  "pr_count": 28,
  "added_at": "2024-07-01T09:30:00Z",
  "ingestion_status": "ingested"
}
