{
  "url": "https://github.com/example-org/example-repo",
  "owner": "example-org",
  "name": "example-repo",
  "stars": 1250,
  "forks": 340,
  "language": "Rust",
  "last_activity": "2024-07-04T15:30:00Z",
  "issue_count": 42,
  "pr_count": 8,
  "added_at": "2024-07-01T09:00:00Z",
  "ingestion_status": "ingested"
}
